{
  "type": "FeatureCollection",
  "features": [
    {
      "type": "Feature",
      "geometry": {
        "type": "Point",
        "coordinates": [
          4.88607,
          52.39247
        ]
      },
      "properties": {
        "mmsi": 244528000,
        "date": "17.10.2025",
        "timestamp_utc": "2025-10-17T08:39:46+00:00",
        "cog": 360.0,
        "sog": 0.0,
        "navigational_status": 8,
        "wetterzustand": "Teilweise bew\u00f6lkt",
        "luftdruck": 1025.8,
        "windrichtung": 328.0,
        "windstaerke": 11.9,
        "bewoelkung": 70.0,
        "lufttemperatur": 13.8,
        "niederschlag": 0.0
      }
    },
    {
      "type": "Feature",
      "geometry": {
        "type": "Point",
        "coordinates": [
          2.92929,
          51.42437
        ]
      },
      "properties": {
        "mmsi": 244528000,
        "date": "19.10.2025",
        "timestamp_utc": "2025-10-19T23:51:38+00:00",
        "cog": 224.4,
        "sog": 4.3,
        "navigational_status": 8,
        "wetterzustand": "M\u00e4\u00dfiger Regen",
        "luftdruck": 997.9,
        "windrichtung": 164.0,
        "windstaerke": 40.0,
        "bewoelkung": 100.0,
        "lufttemperatur": 13.9,
        "wassertemperatur": 15.2,
        "niederschlag": 1.2,
        "wellenhoehe": 0.76
      }
    },
    {
      "type": "Feature",
      "geometry": {
        "type": "Point",
        "coordinates": [
          2.92329,
          51.23392
        ]
      },
      "properties": {
        "mmsi": 244528000,
        "date": "20.10.2025",
        "timestamp_utc": "2025-10-20T04:58:06+00:00",
        "cog": 360.0,
        "sog": 0.0,
        "navigational_status": 5,
        "wetterzustand": "\u00dcberwiegend klar",
        "luftdruck": 996.5,
        "windrichtung": 199.0,
        "windstaerke": 14.8,
        "bewoelkung": 21.0,
        "lufttemperatur": 13.9,
        "wassertemperatur": 15.1,
        "niederschlag": 0.0,
        "wellenhoehe": 0.88
      }
    },
    {
      "type": "Feature",
      "geometry": {
        "type": "Point",
        "coordinates": [
          1.59779,
          50.72777
        ]
      },
      "properties": {
        "mmsi": 244528000,
        "date": "22.10.2025",
        "timestamp_utc": "2025-10-22T15:35:27+00:00",
        "cog": 360.0,
        "sog": 0.0,
        "navigational_status": 5,
        "wetterzustand": "Bedeckt",
        "luftdruck": 996.6,
        "windrichtung": 219.0,
        "windstaerke": 10.2,
        "bewoelkung": 94.0,
        "lufttemperatur": 15.0,
        "wassertemperatur": 15.4,
        "niederschlag": 0.0,
        "wellenhoehe": 0.64
      }
    },
    {
      "type": "Feature",
      "geometry": {
        "type": "Point",
        "coordinates": [
          -0.30661,
          50.00467
        ]
      },
      "properties": {
        "mmsi": 244528000,
        "date": "25.10.2025",
        "timestamp_utc": "2025-10-25T23:51:40+00:00",
        "cog": 222.6,
        "sog": 3.3,
        "navigational_status": 8,
        "wetterzustand": "Bedeckt",
        "luftdruck": 1009.6,
        "windrichtung": 285.0,
        "windstaerke": 46.2,
        "bewoelkung": 88.0,
        "lufttemperatur": 12.3,
        "wassertemperatur": 16.1,
        "niederschlag": 0.0,
        "wellenhoehe": 1.68
      }
    },
    {
      "type": "Feature",
      "geometry": {
        "type": "Point",
        "coordinates": [
          0.13624,
          49.48108
        ]
      },
      "properties": {
        "mmsi": 244528000,
        "date": "26.10.2025",
        "timestamp_utc": "2025-10-26T19:25:11+00:00",
        "cog": 360.0,
        "sog": 0.0,
        "navigational_status": 0,
        "wetterzustand": "Leichter Regen",
        "luftdruck": 1011.7,
        "windrichtung": 260.0,
        "windstaerke": 29.9,
        "bewoelkung": 100.0,
        "lufttemperatur": 12.1,
        "wassertemperatur": 13.4,
        "niederschlag": 0.3,
        "wellenhoehe": 1.32
      }
    },
    {
      "type": "Feature",
      "geometry": {
        "type": "Point",
        "coordinates": [
          -1.60292,
          49.66878
        ]
      },
      "properties": {
        "mmsi": 244528000,
        "date": "30.10.2025",
        "timestamp_utc": "2025-10-30T18:59:00+00:00",
        "cog": 999.0,
        "sog": 0.0,
        "navigational_status": 1,
        "wetterzustand": "Bedeckt",
        "luftdruck": 1005.8,
        "windrichtung": 153.0,
        "windstaerke": 20.1,
        "bewoelkung": 100.0,
        "lufttemperatur": 11.9,
        "wassertemperatur": 15.3,
        "niederschlag": 0.0,
        "wellenhoehe": 0.7
      }
    },
    {
      "type": "Feature",
      "geometry": {
        "type": "Point",
        "coordinates": [
          -1.61933,
          49.63871
        ]
      },
      "properties": {
        "mmsi": 244528000,
        "date": "31.10.2025",
        "timestamp_utc": "2025-10-31T03:24:00+00:00",
        "cog": 999.0,
        "sog": 0.0,
        "navigational_status": 1,
        "wetterzustand": "Teilweise bew\u00f6lkt",
        "luftdruck": 1003.7,
        "windrichtung": 186.0,
        "windstaerke": 21.7,
        "bewoelkung": 77.0,
        "lufttemperatur": 13.9,
        "wassertemperatur": 14.1,
        "niederschlag": 0.0,
        "wellenhoehe": 0.84
      }
    },
    {
      "type": "Feature",
      "geometry": {
        "type": "Point",
        "coordinates": [
          -2.27634,
          49.40612
        ]
      },
      "properties": {
        "mmsi": 244528000,
        "date": "04.11.2025",
        "timestamp_utc": "2025-11-04T23:59:00+00:00",
        "cog": 240.0,
        "sog": 9.1,
        "navigational_status": 0,
        "wetterzustand": "Bedeckt",
        "luftdruck": 1008.5,
        "windrichtung": 174.0,
        "windstaerke": 48.9,
        "bewoelkung": 100.0,
        "lufttemperatur": 15.6,
        "wassertemperatur": 15.1,
        "niederschlag": 0.0,
        "wellenhoehe": 1.34
      }
    },
    {
      "type": "Feature",
      "geometry": {
        "type": "Point",
        "coordinates": [
          -5.62648,
          47.96514
        ]
      },
      "properties": {
        "mmsi": 244528000,
        "date": "05.11.2025",
        "timestamp_utc": "2025-11-05T23:55:00+00:00",
        "cog": 236.0,
        "sog": 3.2,
        "navigational_status": 0,
        "wetterzustand": "Bedeckt",
        "luftdruck": 1000.6,
        "windrichtung": 173.0,
        "windstaerke": 21.0,
        "bewoelkung": 100.0,
        "lufttemperatur": 15.9,
        "wassertemperatur": 14.4,
        "niederschlag": 0.0,
        "wellenhoehe": 3.5
      }
    },
    {
      "type": "Feature",
      "geometry": {
        "type": "Point",
        "coordinates": [
          -6.98937,
          45.97234
        ]
      },
      "properties": {
        "mmsi": 244528000,
        "date": "06.11.2025",
        "timestamp_utc": "2025-11-06T23:52:00+00:00",
        "cog": 201.0,
        "sog": 2.5,
        "navigational_status": 0,
        "wetterzustand": "Bedeckt",
        "luftdruck": 1006.9,
        "windrichtung": 216.0,
        "windstaerke": 33.5,
        "bewoelkung": 100.0,
        "lufttemperatur": 15.8,
        "wassertemperatur": 15.9,
        "niederschlag": 0.0,
        "wellenhoehe": 3.86
      }
    },
    {
      "type": "Feature",
      "geometry": {
        "type": "Point",
        "coordinates": [
          -6.99145,
          45.76475
        ]
      },
      "properties": {
        "mmsi": 244528000,
        "date": "07.11.2025",
        "timestamp_utc": "2025-11-07T03:12:00+00:00",
        "cog": 158.0,
        "sog": 4.5,
        "navigational_status": 0,
        "wetterzustand": "Bedeckt",
        "luftdruck": 1003.4,
        "windrichtung": 201.0,
        "windstaerke": 51.5,
        "bewoelkung": 100.0,
        "lufttemperatur": 16.0,
        "wassertemperatur": 16.1,
        "niederschlag": 0.0,
        "wellenhoehe": 3.7
      }
    },
    {
      "type": "Feature",
      "geometry": {
        "type": "Point",
        "coordinates": [
          -8.38306,
          43.36712
        ]
      },
      "properties": {
        "mmsi": 244528000,
        "date": "08.11.2025",
        "timestamp_utc": "2025-11-08T23:52:14+00:00",
        "cog": 360.0,
        "sog": 0.0,
        "navigational_status": 8,
        "wetterzustand": "\u00dcberwiegend klar",
        "luftdruck": 1022.4,
        "windrichtung": 165.0,
        "windstaerke": 5.6,
        "bewoelkung": 34.0,
        "lufttemperatur": 8.3,
        "wassertemperatur": 16.0,
        "niederschlag": 0.0,
        "wellenhoehe": 2.28
      }
    },
    {
      "type": "Feature",
      "geometry": {
        "type": "Point",
        "coordinates": [
          -9.75554,
          42.06259
        ]
      },
      "properties": {
        "mmsi": 244528000,
        "date": "16.11.2025",
        "timestamp_utc": "2025-11-16T23:58:00+00:00",
        "cog": 210.0,
        "sog": 7.4,
        "navigational_status": 0,
        "wetterzustand": "Teilweise bew\u00f6lkt",
        "luftdruck": 1010.8,
        "windrichtung": 359.0,
        "windstaerke": 30.2,
        "bewoelkung": 58.0,
        "lufttemperatur": 15.6,
        "wassertemperatur": 16.9,
        "niederschlag": 0.0,
        "wellenhoehe": 2.8
      }
    },
    {
      "type": "Feature",
      "geometry": {
        "type": "Point",
        "coordinates": [
          -11.3494,
          40.55882
        ]
      },
      "properties": {
        "mmsi": 244528000,
        "date": "17.11.2025",
        "timestamp_utc": "2025-11-17T16:11:00+00:00",
        "cog": 232.0,
        "sog": 9.6,
        "navigational_status": 0,
        "wetterzustand": "Teilweise bew\u00f6lkt",
        "luftdruck": 1018.9,
        "windrichtung": 16.0,
        "windstaerke": 44.9,
        "bewoelkung": 67.0,
        "lufttemperatur": 17.2,
        "wassertemperatur": 18.0,
        "niederschlag": 0.1,
        "wellenhoehe": 3.08
      }
    },
    {
      "type": "Feature",
      "geometry": {
        "type": "Point",
        "coordinates": [
          -15.60927,
          29.32851
        ]
      },
      "properties": {
        "mmsi": 244528000,
        "date": "21.11.2025",
        "timestamp_utc": "2025-11-21T23:24:00+00:00",
        "cog": 199.0,
        "sog": 8.0,
        "navigational_status": 0,
        "wetterzustand": "\u00dcberwiegend klar",
        "luftdruck": 1020.8,
        "windrichtung": 40.0,
        "windstaerke": 38.1,
        "bewoelkung": 35.0,
        "lufttemperatur": 21.0,
        "wassertemperatur": 22.8,
        "niederschlag": 0.0,
        "wellenhoehe": 2.42
      }
    },
    {
      "type": "Feature",
      "geometry": {
        "type": "Point",
        "coordinates": [
          -16.24385,
          28.46456
        ]
      },
      "properties": {
        "mmsi": 244528000,
        "date": "22.11.2025",
        "timestamp_utc": "2025-11-22T23:52:53+00:00",
        "cog": 360.0,
        "sog": 0.0,
        "navigational_status": 5,
        "wetterzustand": "\u00dcberwiegend klar",
        "luftdruck": 1020.7,
        "windrichtung": 54.0,
        "windstaerke": 12.4,
        "bewoelkung": 36.0,
        "lufttemperatur": 20.0,
        "wassertemperatur": 22.2,
        "niederschlag": 0.0,
        "wellenhoehe": 1.48
      }
    },
    {
      "type": "Feature",
      "geometry": {
        "type": "Point",
        "coordinates": [
          -16.38293,
          28.06353
        ]
      },
      "properties": {
        "mmsi": 244528000,
        "date": "25.11.2025",
        "timestamp_utc": "2025-11-25T23:53:07+00:00",
        "cog": 194.4,
        "sog": 6.3,
        "navigational_status": 8,
        "wetterzustand": "Bedeckt",
        "luftdruck": 1022.3,
        "windrichtung": 50.0,
        "windstaerke": 14.1,
        "bewoelkung": 97.0,
        "lufttemperatur": 18.7,
        "wassertemperatur": 22.1,
        "niederschlag": 0.0,
        "wellenhoehe": 0.88
      }
    },
    {
      "type": "Feature",
      "geometry": {
        "type": "Point",
        "coordinates": [
          -17.35877,
          26.04105
        ]
      },
      "properties": {
        "mmsi": 244528000,
        "date": "26.11.2025",
        "timestamp_utc": "2025-11-26T23:21:14+00:00",
        "cog": 205.0,
        "sog": 7.0,
        "navigational_status": 0,
        "wetterzustand": "Sonnig",
        "luftdruck": 1019.4,
        "windrichtung": 47.0,
        "windstaerke": 17.6,
        "bewoelkung": 5.0,
        "lufttemperatur": 22.0,
        "wassertemperatur": 23.8,
        "niederschlag": 0.0,
        "wellenhoehe": 1.06
      }
    },
    {
      "type": "Feature",
      "geometry": {
        "type": "Point",
        "coordinates": [
          -17.4,
          26.0
        ]
      },
      "properties": {
        "mmsi": 244528000,
        "date": "27.11.2025",
        "timestamp_utc": "2025-11-27T06:05:01+00:00",
        "cog": 370.0,
        "sog": 5.5,
        "navigational_status": 8,
        "wetterzustand": "Sonnig",
        "luftdruck": 1017.9,
        "windrichtung": 10.0,
        "windstaerke": 12.1,
        "bewoelkung": 1.0,
        "lufttemperatur": 21.6,
        "wassertemperatur": 23.7,
        "niederschlag": 0.0,
        "wellenhoehe": 0.98
      }
    },
    {
      "type": "Feature",
      "geometry": {
        "type": "Point",
        "coordinates": [
          -24.24952,
          17.65686
        ]
      },
      "properties": {
        "mmsi": 244528000,
        "date": "30.11.2025",
        "timestamp_utc": "2025-11-30T23:57:26+00:00",
        "cog": 178.0,
        "sog": 6.0,
        "navigational_status": 0,
        "wetterzustand": "Bedeckt",
        "luftdruck": 1013.1,
        "windrichtung": 44.0,
        "windstaerke": 29.8,
        "bewoelkung": 100.0,
        "lufttemperatur": 24.0,
        "wassertemperatur": 25.0,
        "niederschlag": 0.0,
        "wellenhoehe": 1.84
      }
    },
    {
      "type": "Feature",
      "geometry": {
        "type": "Point",
        "coordinates": [
          -24.99722,
          16.88211
        ]
      },
      "properties": {
        "mmsi": 244528000,
        "date": "01.12.2025",
        "timestamp_utc": "2025-12-01T23:40:34+00:00",
        "cog": 210.0,
        "sog": 0.2,
        "navigational_status": 0,
        "wetterzustand": "Bedeckt",
        "luftdruck": 1015.1,
        "windrichtung": 82.0,
        "windstaerke": 10.5,
        "bewoelkung": 94.0,
        "lufttemperatur": 24.8,
        "wassertemperatur": 24.4,
        "niederschlag": 0.0,
        "wellenhoehe": 1.24
      }
    },
    {
      "type": "Feature",
      "geometry": {
        "type": "Point",
        "coordinates": [
          -25.33338,
          17.01892
        ]
      },
      "properties": {
        "mmsi": 244528000,
        "date": "04.12.2025",
        "timestamp_utc": "2025-12-04T15:46:23+00:00",
        "cog": 360.0,
        "sog": 0.0,
        "navigational_status": 1,
        "wetterzustand": "\u00dcberwiegend klar",
        "luftdruck": 1013.6,
        "windrichtung": 41.0,
        "windstaerke": 12.0,
        "bewoelkung": 18.0,
        "lufttemperatur": 28.0,
        "wassertemperatur": 25.4,
        "niederschlag": 0.0,
        "wellenhoehe": 1.88
      }
    },
    {
      "type": "Feature",
      "geometry": {
        "type": "Point",
        "coordinates": [
          -25.9,
          17.0
        ]
      },
      "properties": {
        "mmsi": 244528000,
        "date": "05.12.2025",
        "timestamp_utc": "2025-12-05T17:46:06+00:00",
        "cog": 370.0,
        "sog": 5.5,
        "navigational_status": 8,
        "wetterzustand": "Bedeckt",
        "luftdruck": 1014.8,
        "windrichtung": 53.0,
        "windstaerke": 25.7,
        "bewoelkung": 92.0,
        "lufttemperatur": 23.5,
        "wassertemperatur": 25.2,
        "niederschlag": 0.0,
        "wellenhoehe": 2.36
      }
    },
    {
      "type": "Feature",
      "geometry": {
        "type": "Point",
        "coordinates": [
          -34.39224,
          17.16619
        ]
      },
      "properties": {
        "mmsi": 244528000,
        "date": "08.12.2025",
        "timestamp_utc": "2025-12-08T23:36:14+00:00",
        "cog": 273.0,
        "sog": 5.5,
        "navigational_status": 0,
        "wetterzustand": "\u00dcberwiegend klar",
        "luftdruck": 1018.4,
        "windrichtung": 78.0,
        "windstaerke": 31.3,
        "bewoelkung": 29.0,
        "lufttemperatur": 25.6,
        "wassertemperatur": 26.0,
        "niederschlag": 0.0,
        "wellenhoehe": 2.36
      }
    },
    {
      "type": "Feature",
      "geometry": {
        "type": "Point",
        "coordinates": [
          -35.24572,
          17.23712
        ]
      },
      "properties": {
        "mmsi": 244528000,
        "date": "09.12.2025",
        "timestamp_utc": "2025-12-09T08:01:35+00:00",
        "cog": 264.0,
        "sog": 5.3,
        "navigational_status": 0,
        "wetterzustand": "\u00dcberwiegend klar",
        "luftdruck": 1017.5,
        "windrichtung": 76.0,
        "windstaerke": 24.9,
        "bewoelkung": 20.0,
        "lufttemperatur": 24.8,
        "wassertemperatur": 25.8,
        "niederschlag": 0.0,
        "wellenhoehe": 2.76
      }
    },
    {
      "type": "Feature",
      "geometry": {
        "type": "Point",
        "coordinates": [
          -37.9668,
          17.14683
        ]
      },
      "properties": {
        "mmsi": 244528000,
        "date": "10.12.2025",
        "timestamp_utc": "2025-12-10T11:43:44+00:00",
        "cog": 268.0,
        "sog": 5.9,
        "navigational_status": 0,
        "wetterzustand": "Teilweise bew\u00f6lkt",
        "luftdruck": 1019.8,
        "windrichtung": 76.0,
        "windstaerke": 35.3,
        "bewoelkung": 61.0,
        "lufttemperatur": 25.4,
        "wassertemperatur": 26.2,
        "niederschlag": 0.0,
        "wellenhoehe": 2.86
      }
    },
    {
      "type": "Feature",
      "geometry": {
        "type": "Point",
        "coordinates": [
          -50.89819,
          16.5315
        ]
      },
      "properties": {
        "mmsi": 244528000,
        "date": "15.12.2025",
        "timestamp_utc": "2025-12-15T10:10:21+00:00",
        "cog": 270.0,
        "sog": 3.9,
        "navigational_status": 0,
        "wetterzustand": "Teilweise bew\u00f6lkt",
        "luftdruck": 1015.9,
        "windrichtung": 87.0,
        "windstaerke": 36.0,
        "bewoelkung": 76.0,
        "lufttemperatur": 25.3,
        "wassertemperatur": 26.6,
        "niederschlag": 0.0,
        "wellenhoehe": 3.16
      }
    },
    {
      "type": "Feature",
      "geometry": {
        "type": "Point",
        "coordinates": [
          -61.4992,
          16.20136
        ]
      },
      "properties": {
        "mmsi": 244528000,
        "date": "18.12.2025",
        "timestamp_utc": "2025-12-18T23:56:25+00:00",
        "cog": 360.0,
        "sog": 0.1,
        "navigational_status": 1,
        "wetterzustand": "Teilweise bew\u00f6lkt",
        "luftdruck": 1015.7,
        "windrichtung": 109.0,
        "windstaerke": 6.5,
        "bewoelkung": 48.0,
        "lufttemperatur": 24.0,
        "wassertemperatur": 27.8,
        "niederschlag": 0.0,
        "wellenhoehe": 1.7
      }
    },
    {
      "type": "Feature",
      "geometry": {
        "type": "Point",
        "coordinates": [
          -61.39253,
          15.3004
        ]
      },
      "properties": {
        "mmsi": 244528000,
        "date": "21.12.2025",
        "timestamp_utc": "2025-12-21T23:54:08+00:00",
        "cog": 360.0,
        "sog": 0.1,
        "navigational_status": 1,
        "wetterzustand": "\u00dcberwiegend klar",
        "luftdruck": 1014.8,
        "windrichtung": 83.0,
        "windstaerke": 18.8,
        "bewoelkung": 20.0,
        "lufttemperatur": 26.8,
        "wassertemperatur": 27.5,
        "niederschlag": 0.0,
        "wellenhoehe": 1.18
      }
    },
    {
      "type": "Feature",
      "geometry": {
        "type": "Point",
        "coordinates": [
          -62.73228,
          14.85009
        ]
      },
      "properties": {
        "mmsi": 244528000,
        "date": "25.12.2025",
        "timestamp_utc": "2025-12-25T23:18:26+00:00",
        "cog": 24.0,
        "sog": 8.1,
        "navigational_status": 0,
        "wetterzustand": "Teilweise bew\u00f6lkt",
        "luftdruck": 1012.5,
        "windrichtung": 60.0,
        "windstaerke": 12.1,
        "bewoelkung": 47.0,
        "lufttemperatur": 26.5,
        "wassertemperatur": 27.7,
        "niederschlag": 0.0,
        "wellenhoehe": 1.34
      }
    },
    {
      "type": "Feature",
      "geometry": {
        "type": "Point",
        "coordinates": [
          -64.59858,
          14.16062
        ]
      },
      "properties": {
        "mmsi": 244528000,
        "date": "26.12.2025",
        "timestamp_utc": "2025-12-26T14:41:06+00:00",
        "cog": 244.0,
        "sog": 7.3,
        "navigational_status": 0,
        "wetterzustand": "Teilweise bew\u00f6lkt",
        "luftdruck": 1014.8,
        "windrichtung": 77.0,
        "windstaerke": 16.2,
        "bewoelkung": 60.0,
        "lufttemperatur": 26.3,
        "wassertemperatur": 27.7,
        "niederschlag": 0.0,
        "wellenhoehe": 1.3
      }
    },
    {
      "type": "Feature",
      "geometry": {
        "type": "Point",
        "coordinates": [
          -70.03329,
          12.50849
        ]
      },
      "properties": {
        "mmsi": 244528000,
        "date": "28.12.2025",
        "timestamp_utc": "2025-12-28T20:01:18+00:00",
        "cog": 360.0,
        "sog": 0.0,
        "navigational_status": 1,
        "wetterzustand": "\u00dcberwiegend klar",
        "luftdruck": 1010.9,
        "windrichtung": 78.0,
        "windstaerke": 29.8,
        "bewoelkung": 28.0,
        "lufttemperatur": 27.5,
        "wassertemperatur": 27.0,
        "niederschlag": 0.0,
        "wellenhoehe": 1.3
      }
    },
    {
      "type": "Feature",
      "geometry": {
        "type": "Point",
        "coordinates": [
          -70.3355,
          12.5387
        ]
      },
      "properties": {
        "mmsi": 244528000,
        "date": "30.12.2025",
        "timestamp_utc": "2025-12-30T15:41:24+00:00",
        "cog": 274.0,
        "sog": 7.8,
        "navigational_status": 0,
        "wetterzustand": "Bedeckt",
        "luftdruck": 1013.1,
        "windrichtung": 86.0,
        "windstaerke": 32.5,
        "bewoelkung": 87.0,
        "lufttemperatur": 26.9,
        "wassertemperatur": 26.7,
        "niederschlag": 0.0,
        "wellenhoehe": 1.54
      }
    },
    {
      "type": "Feature",
      "geometry": {
        "type": "Point",
        "coordinates": [
          -74.19833,
          11.3442
        ]
      },
      "properties": {
        "mmsi": 244528000,
        "date": "31.12.2025",
        "timestamp_utc": "2025-12-31T23:41:54+00:00",
        "cog": 246.0,
        "sog": 6.6,
        "navigational_status": 0,
        "wetterzustand": "Teilweise bew\u00f6lkt",
        "luftdruck": 1010.1,
        "windrichtung": 46.0,
        "windstaerke": 25.5,
        "bewoelkung": 46.0,
        "lufttemperatur": 26.3,
        "wassertemperatur": 26.2,
        "niederschlag": 0.0,
        "wellenhoehe": 1.1
      }
    },
    {
      "type": "Feature",
      "geometry": {
        "type": "Point",
        "coordinates": [
          -74.21694,
          11.2443
        ]
      },
      "properties": {
        "mmsi": 244528000,
        "date": "01.01.2026",
        "timestamp_utc": "2026-01-01T08:00:06+00:00",
        "cog": 250.0,
        "sog": 0.4,
        "navigational_status": 0,
        "wetterzustand": "Bedeckt",
        "luftdruck": 1008.5,
        "windrichtung": 23.0,
        "windstaerke": 11.8,
        "bewoelkung": 100.0,
        "lufttemperatur": 30.2,
        "wassertemperatur": 26.6,
        "niederschlag": 0.0,
        "wellenhoehe": 0.98
      }
    }
  ]
}